{
  "candidate_id": "reset_config",
  "functional": {
    "commands": [
      [
        "iverilog",
        "-g2012",
        "-o",
        "${SVGAP_BUILD}/sim.vvp",
        "design.sv",
        "/tasks/reset_config/tb.sv"
      ],
      [
        "vvp",
        "${SVGAP_BUILD}/sim.vvp"
      ]
    ],
    "evidence": {},
    "imported_from": null,
    "returncodes": [
      10
    ],
    "status": "compile_error",
    "stderr": "design.sv:4: syntax error\ndesign.sv:4: error: Invalid module item.\ndesign.sv:6: syntax error\ndesign.sv:1: error: Syntax error in variable list.\ndesign.sv:21: syntax error\ndesign.sv:21: Syntax in assignment statement l-value.\ndesign.sv:23: syntax error\ndesign.sv:23: Syntax in assignment statement l-value.\ndesign.sv:28: syntax error\ndesign.sv:28: error: Syntax error in continuous assignment\n",
    "stdout": "",
    "tool_versions": {
      "iverilog": "Icarus Verilog version 14.0 (devel) (s20251012-184-ge4c424726-dirty)",
      "vvp": "Icarus Verilog runtime version 14.0 (devel) (s20251012-184-ge4c424726-dirty)"
    }
  },
  "gap_member": false,
  "generated_at": "2026-07-05T07:38:33.217710+00:00",
  "manifest": "/output/deepseek-coder-v2-16b--sample-01/reset_config/manifest.toml",
  "schema_version": "1.0",
  "structural": {
    "backend": "reference-yosys",
    "backend_version": "0.1",
    "diagnostics": [],
    "findings": [
      {
        "evidence": {
          "cell": "$procdff$16",
          "clock": "config",
          "reset": "global_reset",
          "source_location": "design.sv:10.3-16.6"
        },
        "message": "raw asynchronous reset reaches an unmarked state element although synchronous deassertion is required",
        "rule_id": "REF-RDC-001",
        "severity": "error"
      }
    ],
    "status": "fail",
    "tool_versions": {
      "yosys": "Yosys 0.64+199 (git sha1 bfc09777e-dirty, aarch64-linux-gnu-g++ 11.4.0-1ubuntu1~22.04 -fPIC -O3)"
    }
  }
}
