{
  "candidate_id": "reset_fsm",
  "functional": {
    "commands": [
      [
        "iverilog",
        "-g2012",
        "-o",
        "${SVGAP_BUILD}/sim.vvp",
        "design.sv",
        "/tasks/reset_fsm/tb.sv"
      ],
      [
        "vvp",
        "${SVGAP_BUILD}/sim.vvp"
      ]
    ],
    "evidence": {},
    "imported_from": null,
    "returncodes": [
      1
    ],
    "status": "compile_error",
    "stderr": "design.sv:22: error: Unable to bind wire/reg/memory `next_state' in `tb.dut'\ndesign.sv:26:      : A symbol with that name was declared here. Check for declaration after use.\n1 error(s) during elaboration.\n",
    "stdout": "",
    "tool_versions": {
      "iverilog": "Icarus Verilog version 14.0 (devel) (s20251012-184-ge4c424726-dirty)",
      "vvp": "Icarus Verilog runtime version 14.0 (devel) (s20251012-184-ge4c424726-dirty)"
    }
  },
  "gap_member": false,
  "generated_at": "2026-07-05T07:40:57.327001+00:00",
  "manifest": "/output/qwen2.5-coder-7b--sample-02/reset_fsm/manifest.toml",
  "schema_version": "1.0",
  "structural": {
    "backend": "reference-yosys",
    "backend_version": "0.1",
    "diagnostics": [
      "ERROR: Latch inferred for signal `\\reset_fsm.\\busy_reg' from always_comb process `\\reset_fsm.$proc$/output/qwen2.5-coder-7b--sample-02/reset_fsm/design.sv:27$3'."
    ],
    "findings": [],
    "status": "tool_error",
    "tool_versions": {
      "yosys": "Yosys 0.64+199 (git sha1 bfc09777e-dirty, aarch64-linux-gnu-g++ 11.4.0-1ubuntu1~22.04 -fPIC -O3)"
    }
  }
}
