{
  "candidate_id": "reset_fsm",
  "functional": {
    "commands": [
      [
        "iverilog",
        "-g2012",
        "-o",
        "${SVGAP_BUILD}/sim.vvp",
        "design.sv",
        "/tasks/reset_fsm/tb.sv"
      ],
      [
        "vvp",
        "${SVGAP_BUILD}/sim.vvp"
      ]
    ],
    "evidence": {},
    "imported_from": null,
    "returncodes": [
      0,
      0
    ],
    "status": "pass",
    "stderr": "\n",
    "stdout": "\nFUNCTIONAL_PASS reset_fsm\n/tasks/reset_fsm/tb.sv:10: $finish called at 78 (1s)\n",
    "tool_versions": {
      "iverilog": "Icarus Verilog version 14.0 (devel) (s20251012-184-ge4c424726-dirty)",
      "vvp": "Icarus Verilog runtime version 14.0 (devel) (s20251012-184-ge4c424726-dirty)"
    }
  },
  "gap_member": false,
  "generated_at": "2026-07-05T07:38:34.058281+00:00",
  "manifest": "/output/deepseek-coder-v2-16b--sample-01/reset_fsm/manifest.toml",
  "schema_version": "1.0",
  "structural": {
    "backend": "reference-yosys",
    "backend_version": "0.1",
    "diagnostics": [
      "ERROR: Latch inferred for signal `\\reset_fsm.\\next_state' from always_comb process `\\reset_fsm.$proc$/output/deepseek-coder-v2-16b--sample-01/reset_fsm/design.sv:7$1'."
    ],
    "findings": [],
    "status": "tool_error",
    "tool_versions": {
      "yosys": "Yosys 0.64+199 (git sha1 bfc09777e-dirty, aarch64-linux-gnu-g++ 11.4.0-1ubuntu1~22.04 -fPIC -O3)"
    }
  }
}
